title,url
2012-2013 Rihanna,https://www.reddit.com/gallery/130a7dj
"Chris Brown complains people ‘still hate’ him for assaulting Rihanna, names white stars accused of domestic violence",https://pagesix.com/2023/02/17/chris-brown-complains-people-hate-him-for-rihanna-assault/
Rihanna accused of ‘worst lip sync ever’ at Super Bowl,https://nypost.com/2023/02/13/rihanna-accused-of-lip-syncing-at-super-bowl-halftime-show/
"Rihanna Will Star in, Score, and Produce a New ‘Smurfs’ Movie",https://www.indiewire.com/2023/04/rihanna-smurfs-movie-original-music-1234833037/
Rihanna’s ‘Umbrella’ Was Used As A Weapon Of Torture In Hell Claims A Michigan Priest Who Allegedly ‘Died’ For Some Time: “Demons Were Singing It”,https://www.themissinternet.com/rihannas-umbrella-was-used-as-a-weapon-of-torture-in-hell-claims-a-michigan-priest-who-allegedly-died-for-some-time-demons-were-singing-it/
The Number Ones: Rihanna’s “Disturbia”,https://www.stereogum.com/2220829/the-number-ones-rihannas-disturbia/columns/the-number-ones/
"Rihanna Is Pregnant, Rep Confirms Following Super Bowl Halftime Show",https://www.hollywoodreporter.com/news/music-news/rihanna-pregnant-rep-confirms-super-bowl-halftime-show-1235323383/?utm_source=twitter&utm_medium=social
[Kleiman] Chiefs QB Patrick Mahomes revealed that Andy Reid threatened to bench any KC player who left the locker room to watch the Rihanna's halftime show,https://twitter.com/nfl_dovkleiman/status/1625503004735705093?s=46&t=8mIcYmunMLODezXRrIScDg
Rihanna and Teyana Taylor beef,https://www.reddit.com/gallery/12twj5s
I think the most patriotic part of the entire Super Bowl was Rihanna’s halftime performance,https://www.reddit.com/r/Jokes/comments/111o00t/i_think_the_most_patriotic_part_of_the_entire/
Malala shares photo meeting Rihanna,https://i.redd.it/6bfoat5qmxna1.jpg
Rihanna has a net worth of $1.4 billion despite not writing any of her own music,https://www.reddit.com/r/redscarepod/comments/1336gkq/rihanna_has_a_net_worth_of_14_billion_despite_not/
The Number Ones: Rihanna’s “Take A Bow”,https://www.stereogum.com/2219799/the-number-ones-rihannas-take-a-bow/columns/the-number-ones/
Anyone else VERY disappointed in Rihanna’s half time show?,https://www.reddit.com/r/RandomThoughts/comments/110wwv4/anyone_else_very_disappointed_in_rihannas_half/
Where were all you gatekeepers when Rihanna was cosplaying as a hardcore kid in Battleship?,https://www.reddit.com/gallery/124p0ip
Rihanna LOVES her louis vuitton lately,https://www.reddit.com/gallery/12zjq5v
Olivia Wilde’s reaction to A$AP Rocky Supporting Rihanna at the Superbowl,https://i.redd.it/bnaik02bm2ia1.jpg
Rihanna. So what do you think? ;),https://www.reddit.com/gallery/12o0erp
PETA's public letter to Rihanna after she was allegedly seen wearing a real fur coat,https://i.redd.it/73cidcw3ogka1.jpg
Justina Miles (deaf performer) performing Super Bowl LVII (2023) Halftime Show by Rihanna in ASL,https://v.redd.it/ggm6rxw6syha1
Rihanna’s street style over the years,https://www.reddit.com/gallery/12gornt
"Rihanna Is Pregnant, Rep Confirms Following Super Bowl Halftime Show",https://www.hollywoodreporter.com/news/music-news/rihanna-pregnant-rep-confirms-super-bowl-halftime-show-1235323383/
Rihanna Reveals She and A$AP Rocky Didn't Have a Nanny After Son's Birth: 'Just Us as Parents',https://people.com/parents/rihanna-asap-rocky-didnt-have-nanny-after-son-birth/
Rihanna,https://www.reddit.com/r/childfree/comments/11109lq/rihanna/
IS RIHANNA PREGNANT AGAIN?!?,https://i.redd.it/d1hugrwjiwha1.jpg
Rihanna Super Bowl Halftime Show Game Thread,https://www.reddit.com/r/hiphopheads/comments/110vwji/rihanna_super_bowl_halftime_show_game_thread/
"Rihanna, Taylor Swift among the few celebrities paying Twitter to keep their blue checkmarks",https://mashable.com/article/twitter-blue-celebrity-subscribers
Rihanna did that.,https://i.redd.it/ljzq08wknwha1.jpg
The Number Ones: Rihanna’s “Umbrella” (Feat. Jay-Z),https://www.stereogum.com/2216907/the-number-ones-rihannas-umbrella-feat-jay-z/columns/the-number-ones/
Rihanna promises 'jam-packed' Super Bowl halftime show as she preps for first live event in seven years,https://www.nbcnews.com/pop-culture/pop-culture-news/rihanna-promises-jam-packed-super-bowl-halftime-show-preps-first-live-rcna69988
[Highlight] Rihanna arrives on a floating platform to the Superbowl Halftime Show,https://twitter.com/NFL/status/1624943944328187905?s=20&t=oCXe30MNvg-td9S7KcuWtw
Rihanna'nın çıkardı pijama takımı götten sikişe yeni bir soluk getirecek gibi,https://www.reddit.com/gallery/12ghelc
Rihanna Shows the Triangle Hand Symbol Before the Camera Cuts Out During the Super Bowl LVII - Reposting Because OP Didn't Include a Submission Statement,https://i.redd.it/a5dhpxyb53ia1.jpg
"Rihanna Will Star in, Score, and Produce a New ‘Smurfs’ Movie",https://www.indiewire.com/2023/04/rihanna-smurfs-movie-original-music-1234833037/
"he calls Rihanna old and fat, I get called a dipshit simp — truth wins in the end",https://i.imgur.com/eYeGhXg.jpg
Rihanna Soars In Super Bowl Halftime Show With Pure Solo Spectacle; ‘Umbrella’ Singer Reveals Baby Bump Before TV Largest Crowd,https://deadline.com/2023/02/rihanna-super-bowl-halftime-review-baby-bump-nfl-fox-jayz-1235257199/
Aparentemente ter dois filhos com a Rihanna é coisa de homem fraco,https://i.redd.it/wur7f9eky7ja1.jpg
"[OC] Incredibly, Rihanna is the number 1 best-selling music artist of all time, beating legends like the Beatles or Elvis to the top spot.",https://i.redd.it/gglygrku66da1.png
Rihanna’s FULL Apple Music Super Bowl LVII Halftime Show,https://youtu.be/HjBo--1n8lI
Rihanna's Super Bowl Halftime Show Generates 103 FCC Complaints For Being Too Sexual,https://www.tmz.com/2023/02/23/rihanna-superbowl-halftime-fcc-complaints/
"Bikini team battle: team 1 (Jessica Alba, Madison Beer, Rihanna) vs team 2 (Margot Robbie, Brie Larson, Beyonce)",https://i.redd.it/96x9su33c6sa1.jpg
"Stew Peters claims that Rihanna wore a pentagram on her belt when in reality it was just a regular belt buckle, as can be seen on the second screenshot.",https://www.reddit.com/gallery/111dmm2
